{
  "schema": "decision-event/v1", "eventId": "event-decision-fixture", "workspaceRevision": 1, "opId": "op-decision-fixture", "decisionId": "dec_FIXTURE", "type": "decision_proposed",
  "actor": { "principal": { "personId": "person-proposer" }, "executor": null }, "source": "local", "occurredAt": "2026-08-13T00:00:00.000Z",
  "payload": { "title": "Event-backed Decision", "question": "Should Decision truth be event-backed?", "riskTier": "medium", "urgency": "medium", "vertical": "default", "preset": "default", "appliesTo": { "modules": ["kernel"], "productLines": [] }, "decisionClass": "ordinary", "chosen": [{ "id": "CH1", "text": "Use canonical events", "rationale": "Replayable" }], "rejected": [{ "id": "RJ1", "text": "Use an authored source", "whyNot": "Not canonical" }], "body": "\n# Event-backed Decision\n", "claims": [], "fulfillments": [], "relations": [], "baseDocumentSha256": null, "decisionDocumentClaim": { "path": "decisions/decision-dec_FIXTURE/decision.md", "sha256": "0000000000000000000000000000000000000000000000000000000000000000", "size": 1, "mediaType": "text/markdown", "policyId": "markdown-body-replaceable/v1" } }
}
