{"actor":{"executor":null,"principal":{"personId":"person-fixture"}},"decisionId":"dec_FIXTURE_DIGEST","eventId":"event-fixture-decision-proposed","occurredAt":"2026-08-13T00:00:00.000Z","opId":"op-fixture-decision-proposed","payload":{"appliesTo":{"modules":["kernel"],"productLines":[]},"baseDocumentSha256":null,"body":"\n# Canonical Decision\n\nThis fixture records concrete decision prose before exercising the canonical acceptance transition.\n","chosen":[{"id":"CH1","text":"Use events"}],"claims":[],"decisionClass":"ordinary","decisionDocumentClaim":{"mediaType":"text/markdown","path":"decisions/decision-dec_FIXTURE_DIGEST/decision.md","policyId":"markdown-body-replaceable/v1","sha256":"fac1ea1a5675ed78ca56a1f9042300517e1e2983fd2bade8e816056a01a3249d","size":745},"fulfillments":[],"preset":"default","question":"Is this event-backed?","rejected":[{"id":"RJ1","text":"Use files","whyNot":"Files are not canonical."}],"relations":[],"riskTier":"medium","title":"Canonical Decision","urgency":"medium","vertical":"test"},"schema":"decision-event/v1","source":"local","type":"decision_proposed","workspaceRevision":10}
