{"actor":{"executor":null,"principal":{"personId":"person-fixture"}},"decisionId":"dec_3EDA6CB375B2D38FA9DAAE9CD8","eventId":"event-d7c82293aea02fd77ff9bdf28c15b87c3e736273e4cd2bc17fecb2a070b1a3ff","occurredAt":"2026-08-31T19:14:02.311Z","opId":"op_562a0f14a9a005595f2632684d569efa1615cec3b25fa5c7b1681b4ac5074cf1","payload":{"baseDocumentSha256":"39b3a43627e9004d8c70034dd9823530ade0524e68b6452eba5a528449350379","claimId":"C1","decisionDocumentClaim":{"mediaType":"text/markdown","path":"decisions/decision-dec_3EDA6CB375B2D38FA9DAAE9CD8/decision.md","policyId":"markdown-body-replaceable/v1","sha256":"66fb66de07683582da789eb878fd507419ff561de5961081a4a9a042cb53dbde","size":4009},"mode":"evidenced"},"schema":"decision-event/v1","source":"local","type":"decision_claim_fulfillment_declared","workspaceRevision":42578}
