{"actor":{"executor":null,"principal":{"personId":"person-fixture"}},"decisionId":"dec_8AF65DA6436BAEF9DE764B485B","eventId":"event-151c202b5f100e71538b6f56a258829f5f98672bd557c6ef2beee36b158e391e","occurredAt":"2026-09-02T00:34:43.846Z","opId":"op_747659be4252f1bb4d51d94d07b74ed7e2d51c0b852cd015383be89eb02e43d9","payload":{"baseDocumentSha256":"251a6b6bbc980acf5d3ea5b2b8542d497b578f6db40ccf30ce9f5e3f1fedc42d","contentPin":{"action":"accept","actor":{"executor":null,"principal":{"personId":"person-fixture"}},"digest":"sha256:9a5d7d80f0eaa2f5789ef74a7c2647ee71d91fc2188968e2d613e77feeb35cc9","evidence":"Fixture evidence","pinId":"dcp_151c202b5f100e71538b6f56a2","pinnedAt":"2026-09-02T00:34:43.846Z","schema":"decision-content-pin/v1","state":"in_effect"},"decisionDocumentClaim":{"mediaType":"text/markdown","path":"decisions/decision-dec_8AF65DA6436BAEF9DE764B485B/decision.md","policyId":"markdown-body-replaceable/v1","sha256":"e667069432eb2b38dcc31727a37ace262fc8f30e571613784418b7f96e9bdb55","size":4660},"fulfillments":[],"judgmentConsent":{"action":"accept","actor":{"executor":null,"principal":{"personId":"person-fixture"}},"consentId":"djc_151c202b5f100e71538b6f56a2","consentedAt":"2026-09-02T00:34:43.846Z","decisionId":"dec_8AF65DA6436BAEF9DE764B485B","machineDigest":"sha256:9a5d7d80f0eaa2f5789ef74a7c2647ee71d91fc2188968e2d613e77feeb35cc9","schema":"decision-judgment-consent/v1","source":"local","targetState":"in_effect"},"judgmentOnlyRationale":null,"rationale":"Fixture rationale","standingPolicy":false},"schema":"decision-event/v1","source":"local","type":"decision_accepted","workspaceRevision":51222}
